{
  "distributions": [
    {
      "type": "HadronicUnpolarizedIntensity",
      "name": "compass_3pi_JP=1+_M=0_1540_1560",
      "decay_description": {
        "kinematics": {
          "initial_state": {
            "index": 0,
            "spin": "1",
            "name": "X_3pi",
            "mass": 1.55
          },
          "final_state": [
            {
              "index": 1,
              "spin": "0",
              "name": "pi-",
              "mass": 0.13956755
            },
            {
              "index": 2,
              "spin": "0",
              "name": "pi+",
              "mass": 0.13956755
            },
            {
              "index": 3,
              "spin": "0",
              "name": "pi-",
              "mass": 0.13956755
            }
          ]
        },
        "reference_topology": [[2, 3], 1],
        "chains": [
          {
            "propagators": [
              {
                "spin": "1",
                "node": [2, 3],
                "parametrization": "R(768)"
              }
            ],
            "weight": "-0.12012506941576646 - 0.0i",
            "vertices": [
              {
                "type": "ls",
                "l": "0",
                "s": "1",
                "node": [[2, 3], 1],
                "formfactor": "X_BlattWeisskopf_L0"
              },
              {
                "type": "ls",
                "l": "1",
                "s": "0",
                "node": [2, 3],
                "formfactor": "subchannel_BlattWeisskopf_R(768)_l1"
              }
            ],
            "topology": [[2, 3], 1],
            "name": "1-(1++)0+rhopiS"
          },
          {
            "propagators": [
              {
                "spin": "1",
                "node": [1, 2],
                "parametrization": "R(768)"
              }
            ],
            "weight": "0.12012506941576646 + 0.0i",
            "vertices": [
              {
                "type": "ls",
                "l": "0",
                "s": "1",
                "node": [[1, 2], 3],
                "formfactor": "X_BlattWeisskopf_L0"
              },
              {
                "type": "ls",
                "l": "1",
                "s": "0",
                "node": [1, 2],
                "formfactor": "subchannel_BlattWeisskopf_R(768)_l1"
              }
            ],
            "topology": [[1, 2], 3],
            "name": "1-(1++)0+rhopiS"
          },
          {
            "propagators": [
              {
                "spin": "1",
                "node": [2, 3],
                "parametrization": "R(768)"
              }
            ],
            "weight": "0.011929004311473054 + 0.03779700129642433i",
            "vertices": [
              {
                "type": "ls",
                "l": "2",
                "s": "1",
                "node": [[2, 3], 1],
                "formfactor": "X_BlattWeisskopf_L2"
              },
              {
                "type": "ls",
                "l": "1",
                "s": "0",
                "node": [2, 3],
                "formfactor": "subchannel_BlattWeisskopf_R(768)_l1"
              }
            ],
            "topology": [[2, 3], 1],
            "name": "1-(1++)0+rhopiD"
          },
          {
            "propagators": [
              {
                "spin": "1",
                "node": [1, 2],
                "parametrization": "R(768)"
              }
            ],
            "weight": "-0.011929004311473054 - 0.03779700129642433i",
            "vertices": [
              {
                "type": "ls",
                "l": "2",
                "s": "1",
                "node": [[1, 2], 3],
                "formfactor": "X_BlattWeisskopf_L2"
              },
              {
                "type": "ls",
                "l": "1",
                "s": "0",
                "node": [1, 2],
                "formfactor": "subchannel_BlattWeisskopf_R(768)_l1"
              }
            ],
            "topology": [[1, 2], 3],
            "name": "1-(1++)0+rhopiD"
          },
          {
            "propagators": [
              {
                "spin": "0",
                "node": [2, 3],
                "parametrization": "R(600)"
              }
            ],
            "weight": "0.24367979070784807 - 0.33431568424813957i",
            "vertices": [
              {
                "type": "ls",
                "l": "1",
                "s": "0",
                "node": [[2, 3], 1],
                "formfactor": "X_BlattWeisskopf_L1"
              },
              {
                "type": "ls",
                "l": "0",
                "s": "0",
                "node": [2, 3],
                "formfactor": "subchannel_BlattWeisskopf_R(600)_l0"
              }
            ],
            "topology": [[2, 3], 1],
            "name": "1-(1++)0+(pipi)_SpiP"
          },
          {
            "propagators": [
              {
                "spin": "0",
                "node": [1, 2],
                "parametrization": "R(600)"
              }
            ],
            "weight": "0.24367979070784807 - 0.33431568424813957i",
            "vertices": [
              {
                "type": "ls",
                "l": "1",
                "s": "0",
                "node": [[1, 2], 3],
                "formfactor": "X_BlattWeisskopf_L1"
              },
              {
                "type": "ls",
                "l": "0",
                "s": "0",
                "node": [1, 2],
                "formfactor": "subchannel_BlattWeisskopf_R(600)_l0"
              }
            ],
            "topology": [[1, 2], 3],
            "name": "1-(1++)0+(pipi)_SpiP"
          },
          {
            "propagators": [
              {
                "spin": "2",
                "node": [2, 3],
                "parametrization": "R(1274)"
              }
            ],
            "weight": "0.040206820545245714 + 0.0745609331830681i",
            "vertices": [
              {
                "type": "ls",
                "l": "1",
                "s": "2",
                "node": [[2, 3], 1],
                "formfactor": "X_BlattWeisskopf_L1"
              },
              {
                "type": "ls",
                "l": "2",
                "s": "0",
                "node": [2, 3],
                "formfactor": "subchannel_BlattWeisskopf_R(1274)_l2"
              }
            ],
            "topology": [[2, 3], 1],
            "name": "1-(1++)0+f2piP"
          },
          {
            "propagators": [
              {
                "spin": "2",
                "node": [1, 2],
                "parametrization": "R(1274)"
              }
            ],
            "weight": "0.040206820545245714 + 0.0745609331830681i",
            "vertices": [
              {
                "type": "ls",
                "l": "1",
                "s": "2",
                "node": [[1, 2], 3],
                "formfactor": "X_BlattWeisskopf_L1"
              },
              {
                "type": "ls",
                "l": "2",
                "s": "0",
                "node": [1, 2],
                "formfactor": "subchannel_BlattWeisskopf_R(1274)_l2"
              }
            ],
            "topology": [[1, 2], 3],
            "name": "1-(1++)0+f2piP"
          },
          {
            "propagators": [
              {
                "spin": "2",
                "node": [2, 3],
                "parametrization": "R(1274)"
              }
            ],
            "weight": "0.10361071290652465 + 0.16432602844516i",
            "vertices": [
              {
                "type": "ls",
                "l": "3",
                "s": "2",
                "node": [[2, 3], 1],
                "formfactor": "X_BlattWeisskopf_L3"
              },
              {
                "type": "ls",
                "l": "2",
                "s": "0",
                "node": [2, 3],
                "formfactor": "subchannel_BlattWeisskopf_R(1274)_l2"
              }
            ],
            "topology": [[2, 3], 1],
            "name": "1-(1++)0+f2piF"
          },
          {
            "propagators": [
              {
                "spin": "2",
                "node": [1, 2],
                "parametrization": "R(1274)"
              }
            ],
            "weight": "0.10361071290652465 + 0.16432602844516i",
            "vertices": [
              {
                "type": "ls",
                "l": "3",
                "s": "2",
                "node": [[1, 2], 3],
                "formfactor": "X_BlattWeisskopf_L3"
              },
              {
                "type": "ls",
                "l": "2",
                "s": "0",
                "node": [1, 2],
                "formfactor": "subchannel_BlattWeisskopf_R(1274)_l2"
              }
            ],
            "topology": [[1, 2], 3],
            "name": "1-(1++)0+f2piF"
          },
          {
            "propagators": [
              {
                "spin": "0",
                "node": [2, 3],
                "parametrization": "R(965)"
              }
            ],
            "weight": "0.03765739909148283 + 0.04895293718480279i",
            "vertices": [
              {
                "type": "ls",
                "l": "1",
                "s": "0",
                "node": [[2, 3], 1],
                "formfactor": "X_BlattWeisskopf_L1"
              },
              {
                "type": "ls",
                "l": "0",
                "s": "0",
                "node": [2, 3],
                "formfactor": "subchannel_BlattWeisskopf_R(965)_l0"
              }
            ],
            "topology": [[2, 3], 1],
            "name": "1-(1++)0+f0(980)piP"
          },
          {
            "propagators": [
              {
                "spin": "0",
                "node": [1, 2],
                "parametrization": "R(965)"
              }
            ],
            "weight": "0.03765739909148283 + 0.04895293718480279i",